,cleanned_tweet
1134760989075935232,raison sécuritaire protocolaire le opposer prendre part obsèquer de eti
1134760927109230593,proud megan sydney grace indigo alexer ryaner kalea chelsey represent today thefuture tal
1134760913645559808,
1134760904254320640,momo like kiyer
1134760894225952768,etienne tshisekedi buried dr
1134760892095258624,programme officiel prévoit bel élévation tshisekedi statut héro national
1134760833840504832,udp aujourd hui préférer hommage fcc acolyte celui opposition vrai opposition comba
1134760831621718017,rendre hommage etienne tshisekedi wa mulumba acteur politique majeur grand combattant lutter p
1134760812621512704,considered equatorial guineer sao tomé principe gabon brazzaville option
1134760806200041473,paesi più pericolosi per donne nel india afghanistan siria somalia arabia saudita pakistan
1134760800529387520,non passer
1134760796792197120,applaudissement nourrir félix tshisekedi stad martyr
1134760793365471232,dire etienne tshisekedi exemple grand cordon lumumba  kabila
1134760776051318784,
1134760763250348032,u border patrol agent assigned del rio sector apprehended large group individual angola cameroon
1134760760033370113,communiquer sanctionner tripartite rdc  angola  rwanda kinshasa
1134760759437643776,
1134760740504707072,last night u border patrol agent apprehended illegal alien angola cameroon near u
1134760723404509184,retour de antipas mbusa nyamwisi kinshaser long exil decrispation fatshimetri
1134760712037965825,i' m south africa imagin sundowns mettre enyimba final
1134760696355463169,beaucoup de aventurier suivre gar
1134760665011200001,lif amid ebola outbreak combating mistrust saving live dr
1134760650528493568,missed last event silly miss one uganda come shak leg 256lin
1134760631238836224,lorsque noir déclarer blanc inutile de échanger valeur principe changer
1134760602931478528,¿ sabíai hay brote ébola flipas el nah eso está muy lejo ya enteraremos cuando infect el
1134760541472415744,hommage etienne tshisekedi repose paix patriarch modèle never give de un combat démocrat
1134760536783151104,applaudi arrivée stad martyr rwanda
1134760534723747840,seul unique héro congolais ce être patrice lumumba
1134760523004895233,osm opendater logicielslibre afrique actionosmbrazzavill étudiant enseignant chercheur travailleu
1134760500363976704,arrivé hier nuire ce être assister obsèque président étienne tshisekedi
1134760484064960513,osm opendater logicielslibre afrique actionosmbrazzavill petit pause famill joyeux troup
1134760457632440321,ne avoir opposant
1134760444365856770,ndeko connai
1134760398610206726,également présent stad martyr trois jour kinshaser
1134760380855607296,etienne tshisekedi buried dr
1134760380318867456,angola rwanda réunion tshisekedi kagame lourenço marge cérémonie hommage vouloir renforce
1134760357828993024,saber sim neeee
1134760324672950273,indépendance ne être que au niveau pays voisin chercher v
1134760320562487301,
1134760301998612480,président républiqu felix antoin tshisekedi tshilombo venir signer le ordonnance porter référence
1134760299196833792,femme victime viol guerre reconstruire prixnobel fondationpanzi eition  v
1134760278581829633,présence guillaume soro deuil étienne tshisekedi wa mulumba engagement de un jeunesse panafricer
1134760268574134272,applaudi arrivée stad martyr rwanda
1134760260370145280,
1134760243886514177,etienne tshisekedi admettre titre posthume ordre national héros national kabila  lumumba grade gr
1134760222327746560,tshisekedi er docteur droit le université lovanium merci ya tshitshi de avoir exemple gén
1134760193814880256,présent obsèque de étienn tshi
1134760151183974401,garde corps de etienne tshisekedi man
1134760121484099584,solo gli ingenui per essere gentil hanno creduto al miracolo del le hanno programmato troppo
1134760114320228352,wish fellow kenyan great madaraka day democratic republic represer president
1134760107764604929,tshisekedi principal opposant absent hommage officiel étienne tshisekedi
1134760053553192961,rdc  kinshasa présent stade martyr
1134760045709840385,report accuser rwanda paulkagame training rebel oust burundian leader story still true today
1134760035773505536,banqu africain développement contribuer hauteur million dollar construction
1134760030954283008,drcongo rdcongo secteur santé programm jour centre santé finaliser
1134760009361960961,tunisie final créteil remontader spectaculaire rd bravo frérot yas
1134760006103031808,séjour capitale congolais kinshaser doux
1134759999555678209,criminel revenir toujours lieu crimer le homme plonger le insécurité parrain gr
1134759991058096128,étienn tshisekedi admettre grand cordon ordr national héros lumumba  kabila moment fort attendre
1134759961479852032,dzieńdziecka także na stadionie przy łazienkowska młodzi piłkarza sprawdzają swój reflek precy
1134759943784058880,man buried became president yr delay body father drc' s presid
1134759943003811840,..
1134759931549298688,osm opendater logicielslibre afrique actionosmbrazzavill brazza quartier diata pixel terrai
1134759913908031488,bâtiment administratif cns peau neuf
1134759908220387328,
1134759907096444928,jeune an jamais connaître paix tel réunion leader
1134759883805470720,former president kabila continu back  door interference governmer politic security council
1134759882488463361,rdcongo tshisekedi symboliquement mbujmayi gen rendre le aéroport cercueil rapatriemen
1134759862771036160,bande taliban devenir républiquette kasai eliquer présence
1134759861856743427,people gav remarkabl gift making father president presidential treer
1134759855338741760,u border patrol agent assigned del rio sector apprehended large group individual angola cameroon
1134759849026367488,etienne tshisekedi admettre titre posthume le ordre national héros national kabila  lumumba
1134759798690406400,
1134759789320441857,etienne tshisekedi admettre titre posthume ordre national héros national kabila  lumumba grade gr
1134759784345980928,article grand cordon grad élevé moment pays
1134759782852825089,etienne tshisekedi admettre titre posthume le ordre national héros national kabila  lumumba
1134759724031893505,tripartitensele photodefamill issu réunion tripartite président rwandais angoler
1134759710584901633,meno tagliare vitalizi e buttate fuori senatori viter letterer ue tria
1134759710077345792,dangerous country women afghanistan syria somalia saudi arabier
1134759697096019968,nobody talking ebola pandemic outbreak first case
1134759695888113669,hermancohen je avoir rencontrer tshisekedi pr ère je être charger mission usa kinshaser
1134759691115008000,children pler tree fight deforestation dr onechildonetree virunga
1134759684009811968,tshisekedi principal opposant absent hommage officiel étienne tshisekedi
1134759664871182336,résolution revendication droit citoyen
1134759654632894464,congo' s reaction kagame arrived tshisekedi funeral
1134759651382374400,
1134759609976184832,buonisti chiedeno percher kenya rhodesia uganda tanganika sud africa che erano nazioni ricch e p
1134759557522235392,u border patrol agent assigned del rio sector apprehended large group individual angola cameroon
1134759526052368385,lindo ver estudante e professore das universidade estaduai dando aula na alerj nosser luta é peler educação públic
1134759515306545152,first mettre etienne tshisekedi u charger de affaire kinshasa consider fathe
1134759511380627456,proud coeditor together fantastic blog series urban insecurity eastern
1134759510046892032,également présent stad martyr trois jour kinshaser
1134759502505533440,étienn tshisekedi admettre titre grand cordon le ordre national héros national kabila  lumumba
1134759498097274880,.. one knowing truth war participation lot untold truth real agenda land reform
1134759485862502400,article grand cordon grad élevé moment pays
1134759473678082048,tshisekedi principal opposant absent hommage officiel étienne tshisekedi
1134759471719354368,bankers club banquier exbanquier assureur imf welcome space exchange eerienc
1134759454988210176,gagner paix voix plutôt que en entretenir climat malsain tension polti
1134759435635699712,politicien traiter mot aujourd'hui y'a certain mang
1134759432766836736,rendre hommage etienne tshisekedi wa mulumba acteur politique majeur grand combattant lutter p
1134759415632949248,okmusic
1134759414169255936,également présent stad martyr trois jour kinshaser
1134759404975349761,etienne tshisekedi buried dr
1134759389808734208,applaudi arrivée stad martyr rwanda
1134759336604028928,john numbi grand officier ô
1134759331520532481,edition spécial hommage etienne tshisekedi jeanjoseph mukendi udps « pense adolphe muzito
1134759278823268352,président etienne tshisekedi effectuer ultime voyage trouver enfin repos éternel
1134759268136230914,farewell l3 hello humanitarian system  wide scaleup activation ebola
1134759255406309377,sir
1134759226058969088,last night u border patrol agent apprehended illegal alien angola cameroon near u
1134759224909737985,président centrafricain faustin archange touadera arrivé capital congolais accueillir
1134759203611000832,brl brazil brazil real bsd bahamas dollar btn bhutan ngultrum cad canada dollar cdf kin
1134759180907294720,applaudi arrivée stad martyr rwanda
1134759159390494720,bâtiment administratif cns peau neuf
1134759132223983617,tshisekedi principal opposant absent hommage officiel étienne tshisekedi
1134759096031227904,
1134759080445321216,tshisekedi principal opposant absent hommage officiel étienne tshisekedi
1134759080432689152,think real really place called
1134759053756960773,lualaba kolwezi constat place nombreux réalisation chantier se activer vigueur
1134759046643191808,dangerous country women afghanistan syria somalia saudi
1134759004771688448,last night u border patrol agent apprehended illegal alien angola cameroon near u
1134758988388741120,speak kris berwout independent central african analyst elain former leader joseph kabila
1134758986430001153,u border patrol agent assigned del rio sector apprehended large group individual angola cameroon
1134758986245464065,non essendo economister fors qualcoser mi sfugg percher dev inventare tutte quest
1134758984223789056,applaudi arrivée stad martyr rwanda
1134758974178308096,_ 19
1134758970067996673,ne avoir aucun confiance mr kagame incarner mauvaiseter mr
1134758967127826432,hermancohen je avoir rencontrer tshisekedi pr ère je être charger mission usa kinshaser
1134758924115152896,ce être pays ne avoir jamais pays
1134758914979819521,.. ...
1134758901600141312,company aiming raise around billion jun equity offering source clore deal said airtel operate
1134758888627195904,ebola crisi threaten spiral control head health agency called outbreak one
1134758883115843584,true ugander need check first treated many foreigner india rwanda su
1134758873066352640,etienne tshisekedi buried dr
1134758856289116160,udp aujourd hui préférer hommage fcc acolyte celui opposition vrai opposition comba
1134758854770610176,president kagame pays respect lat etienne tshisekedi former prime minister democratic republic con
1134758824177541120,wish fellow kenyan great madaraka day democratic republic represer president
1134758814685773824,etienne tshisekedi admettre titre posthume le ordre national héros national kabila  lumumba
1134758802044071936,rosa calling lat jake need help messed rosa sighing pouvoir corpse ice i' ll
1134758797480738816,garde corps de etienne tshisekedi man
1134758781555003392,please president father passed away years ago private matter
1134758775343263744,alfried célibataire brazzavill brazzavill rejoindre chocomeet rencontre dating single
1134758770402353153,baby soul conception identical monozygotic twin
1134758759828467712,nyirarukundo' s face say armed men attacked family democratic republic nyirarukundo ran one way heure
1134758728077631488,territoir beni offensif victorieux fardc jeudi mai heure matin combattant adf
1134758727599493120,etienne tshisekedi buried dr
1134758722574700544,etienne tshisekedi buried dr
1134758717516369920,
1134758706711748608,
1134758696402214912,last night u border patrol agent apprehended illegal alien angola cameroon near u
1134758661769895936,etienne tshisekedi élevé rang de héros national plutôt admit quelque instant titre posthume
1134758622364409857,last night u border patrol agent apprehended illegal alien angola cameroon near u
1134758610335088641,concern tripartite prévoir h30 échange porter notamment coopération régional
1134758609282326529,photo famill vicegouverneur le ituri le occasion le atelier vulgarisation plan de action
1134758603246776320,true ugander need check first treated many foreigner india rwanda su
1134758566345072640,..
1134758559659544576,coeur rendre dernier hommage étienn tshisekedi héro politique marquer
1134758554508902400,fièremer saluer le emblème de or souveraineter
1134758526012862464,true ugander need check first treated many foreigner india rwanda
1134758525786316800,voi cause ne évoluer
1134758503082594305,obsequestshisekedi laurent_cardinal_monsengwo tenir cardinalité entrer stade martyr
1134758498250690560,wish fellow kenyan great madaraka day democratic republic represer president
1134758494496854022,obsèquesetshisekedi dépouille feu etienne tshisekedi arrivée stad martyr
1134758483348336640,rdcongo chefferie mukambo territoire mahagi nouveau cibl attaque part asser
1134758473772802048,
1134758473739227136,
1134758419611639808,
1134758395117015040,présent obsèque de étienn tshi
1134758392248066048,sécuris criminel kagame refuser participer deuil e tshisekedi kab
1134758366406946816,gabriel kyungu wa kumwanzer également présent obsèque de étienn tshisekedi
1134758361302523905,perfectly exemplifie blair get british public concerned power politicians
1134758351500451840,etienne tshisekedi élevé rang de héros national plutôt admit quelque instant titre posthume
1134758350649024512,th day ramadan islamicstate claimed attack outsid syrier iraq surpassed total yemen
1134758350598680576,president kagame pays respect lat etienne tshisekedi former prime minister democratic republic con
1134758326347194368,communiquéfinal sanctionner rencontre tripartite angola  rwanda république démocratique tenir
1134758292662738944,obsèquesetshisekedi président rwandais paul kagame incliné dépouill feu etienne tshiseke
1134758280289374208,
1134758275063386113,kasai central poursuite judiciaire denis kambayi augustin kamwitu annoncer
1134758262899912704,th day ramadan islamicstate claimed attack outsid syrier iraq surpassed total yemen
1134758246064021504,wish fellow kenyan great madaraka day democratic republic represer president
1134758244877066240,obsèquesetshisekedi président angolais joão lourenço incliner dépouill feu etienne tshise
1134758238115827713,tria invier lettera alla commissione ue nessun taglio e quota
1134758201843490816,obsèquesetshisekedi président rwandais paul kagame angolais joão lourenço rendre hommage feu etienn
1134758180628701185,rwanda kagame star tshisekedi ceremonie
1134758175742275584,venir justifier le injustifiable tuer devenir chien chat kagam perso
1134758146042454016,image président comité politique excellence compagni président
1134758122998902784,obsèquesetshisekedi président féli  antoine tshisekedi denis sassou ne guesso participer
1134758108817833984,dhs insider eed us migrant made user confirmed case ebola custody
1134758073917214720,rise sir bert ask posthumou autobiography
1134758072881225728,kabundu katangai tribu lunda voir dire sécher
1134758059203616768,paesi più pericolosi per donne nel india afghanistan siria somalia arabia saudita pakistan
1134758046356271104,rendre hommage etienne tshisekedi wa mulumba acteur politique majeur grand combattant lutter p
1134758023421997056,tripartitensele photodefamill issu réunion tripartite président rwandais angoler
1134758011925196800,choose bouncing character huge fan pixel finally got chance try proper pixel art i' m new
1134757980128387072,tunisie final créteil remontader spectaculaire rd bravo frérot yas
1134757979260145664,tunisie final créteil remontader spectaculaire rd bravo frérot yas
1134757958833848320,seul vérté urne autour le élection présidentiel justifier hommage national e t
1134757926986326016,etienne tshisekedi buried dr
1134757925875064832,tshisekedi principal opposant absent hommage officiel étienne tshisekedi
1134757924134428673,proud coeditor together fantastic blog series urban insecurity east
1134757854949314560,hermancohen je avoir rencontrer tshisekedi pr ère je être charger mission usa kinshaser
1134757841686999040,etienne tshisekedi buried dr
1134757833038323712,lieu juger enterrer général mamadoundala bravoure abner
1134757824670642176,e prétend suivre pats de etienne tshisekedi médiocre de opposant vision proj
1134757807763394562,dhs insider eed us migrant made user confirmed case ebola custody
1134757807494979584,applaudi arrivée stad martyr rwanda
1134757799085428737,company aiming raise around billion jun equity offering source clore deal said airtel
1134757792173187074,e prétend suivre pats de etienne tshisekedi médiocre de opposant vision
1134757745347817472,è saltato all' ultimo minuto dopo mistero della bozza inviater anteprima aller stampa probabilment da qualch man
1134757744412712960,etienne tshisekedi buried dr france surrender
1134757695028912128,ouais ce être vrai malheureusement parfois nombre guerre connaisson r
1134757666570399744,may happines alway face
1134757664460853248,le essentiel minute hommage étienn tshisekedi haïti colérer sénateur état
1134757663064100864,dr mourner pay tribute lat opposition leader
1134757661738754048,
1134757565756248064,coopopopé swag
1134757556356812800,dimanche matin rfi le émission changement politique
1134757554230386688,last night u border patrol agent apprehended illegal alien angola cameroon near u
1134757548161212416,tshisekedi principal opposant absent hommage officiel étienne tshisekedi
1134757533644730369,ce être président felix tshisekedi décor père etienne tshisekedi wa mulumba titre posthume hé
1134757527894331392,tshisekedi principal opposant absent hommage officiel étienne tshisekedi
1134757527084814336,impression majorité intéresser football france espagne
1134757525973286913,tshisekedi principal opposant absent hommage officiel étienne tshisekedi
1134757490128818176,ce être vraiment encourager attendre partie amitier
1134757459480981504,ce être le école joue aimé jeune reporter le être rd le équation simple élè
1134757446566711296,femme victime viol guerre reconstruire prixnobel fondationpanzi e
1134757414945939456,hermancohen je avoir rencontrer tshisekedi pr ère je être charger mission usa kinshaser
1134757361099386880,étienn tshisekedi admettre titre grand cordon le ordre national héros national kabila  lumumba
1134757343172943872,société chinois baser kambove agent commettre erreur travail large diffusion afin autorité
1134757331294654465,etienne tshisekedi élevé statut héro national inhumation jeudi
1134757308217434112,
1134757285387837441,
1134757266551386112,étienn tshisekedi kinshasa dernier voyage opposer historique retrouver article retour
1134757213862539264,quelli di voi sinceramente preoccupati per giustizia social e quindi economicer
1134757198146494465,sassou perd sommeil congo  brazzaville pilotage automatique
1134757144023175168,le élévation rang héros national exiger que un loi axaminé adopter parlement promulguer
1134757122560929793,total case confirmed case confirmed deaths drcongo' s largest  ever known ebola outbreak read
1134757121143300096,applaudi arrivée stad martyr rwanda
1134757116177051648,...    ...
1134757109063659521,è saltato all' ultimo minuto dopo mistero della bozza inviater anteprima aller stampa probabilment da qualch man
1134757082908057601,député mik mukebayi poursuivi diffamation immunité lever attendre pro
1134757077010866176,lo capirà quando per fare flat tax chiuderanno le ospedale vicino caser scuola e taglieranno anch
1134757066806046721,garde corps de etienne tshisekedi man
1134757056316084224,libre ce être façon participer construction
1134757016776466433,excellent mois joindre pièce joindre aujourd'hui ce être premier joint vif joint
1134756993250603008,hermancohen je avoir rencontrer tshisekedi pr ère je être charger mission user kin
1134756992420069376,etienne tshisekedi buried dr
1134756988955615232,obsequestshisekedi total chef de état africain rendre hommage étienn tshisekedi stade
1134756974749474817,tenth global caseload peopl need humanitarian assistance drcongo almost case r
1134756960627302400,zacharie badiengila alias mwander nsemi présent obsèque de étienn tshisekedi
1134756957099896833,bankers club banquier exbanquier assureur imf welcome space exchange eerienc
1134756948883181569,wish fellow kenyan great madaraka day democratic republic represer president
1134756940700106752,gabriel kyungu wa kumwanzer également présent obsèque de étienn tshisekedi
1134756919497895936,dhs insider eed us migrant made user confirmed case ebola custody
1134756919216939015,présent obsèque de étienn tshi
1134756909314187264,last night u border patrol agent apprehended illegal alien angola cameroon near u
1134756892826329089,u border patrol agent assigned del rio sector apprehended large group individual angola cameroon
1134756892444639233,dimanche matin rfi le émission changement politique
1134756881602437122,zacharie badiengila alias mwander nsemi présent obsèque de étienn tshisekedi
1134756867484332032,using dance music theatre way sharing critical information ebola preventi
1134756866720960512,missed last event silly miss one uganda come shak leg 256lin
1134756848882597889,etienne tshisekedi buried dr
1134756848719028224,etienne tshisekedi buried dr
1134756792204967936,direct stad martyr hommage héro national docteur etienne tshisekedi wa mulumba
1134756789046525953,
1134756776799326208,carcarli cancellerebbero è quota modo da ridurre boll
1134756709120053249,gouverneur également présent obsèque de e tshisekedi stad martyr
1134756667621617664,abbraccio insolito è quello che andré bauma capo custod del centro senkwekwe per gorilla orfani nel parco nazional
1134756601410215937,
1134756592686108672,présent obsèque de étienn tshi
1134756569005137920,bankers club banquier exbanquier assureur imf welcome spac exchange yo
1134756547131609088,
1134756545726767109,etienne tshisekedi admettre ordre national héros national kabila  lumumba grade grand cordon officiel ht
1134756538449649664,bantou invitation deuil formellement interdire
1134756522221867008,marché colèr dénoncer présence site homm p
1134756521617833985,opposant absent hommage officiel étienne tshisekedi
1134756472561123329,
1134756465531637762,today bring twenty  seventh part daily ramer ān companion urgent app
1134756414700830720,nender sudani nenda
1134756406211555328,obsèquesetshisekedi président féli  antoine tshisekedi denis sassou ne guesso participer
1134756399878168576,osm opendater logicielslibre afrique actionosmbrazzavill brazza quartier diata pixel terrai
1134756389446922241,etienne tshisekedi élevé statut héro national inhumation jeudi
1134756386527690752,etienne tshisekedi buried dr
1134756356664233984,elain molar pregnancy ectopic pregnancy aca
1134756353392742400,excellent mois joindre pièce joindre aujourd'hui ce être premier joint vif joint
1134756341137006593,urgent étienn tshisekedi admettre titre posthume le ordre national héros national kabila  lumumba
1134756299336572928,dr e tshisekedi grand cordon le ordre national héros national kabila  lumumba
1134756294873812992,president kagame pays respect lat etienne tshisekedi former prime minister democratic republic con
1134756292520816640,rendre haineux tshisekedi deja mort que il hero
1134756291044347904,last night u border patrol agent apprehended illegal alien angola cameroon near u
1134756259754913792,etienne tshisekedi admettre ordre national héros national kabila  lumumba grade grand cordon officiel ht
1134756220861071360,return exil drc' s former governor katanger set shake national politic even
1134756203651899393,libre ce être façon participer construction
1134756158764388353,opposant exclure hommage officiel étienne tshisekedi
1134756125600026624,ze verward vlag van angola mettre die van
1134756083258593280,e quella del restano poi welfare resta pensioni
1134756027700797446,image esclavagiste cidessous insoutenable fait avérer forfait traiter di
1134755985979916289,etienne tshisekedi buried dr
1134755948961120256,montre toujours exemple
1134755945135988736,bâtiment administratif cns peau neuf
1134755928731987970,bâtiment administratif cns peau neuf
1134755880736579584,angola rwanda réunion tshisekedi kagame lourenço marge cérémonie hommage vouloir renforce
1134755865985261568,new post etienne tshisekedi buried dr published rob emporium
1134755865746137088,bénit etienne tshisekedi charisme exceptionnel péser poids le avènement démocratie
1134755865259577344,
1134755863296663553,le emergence de un leader charismatique dépendre trois facteur déterminant temps milieu providence
1134755859052007424,saluon mémoir courage de un leader charismatique combattant acharné devouer de un œuvre majeur
1134755841968525314,
1134755834565672960,kagame ovationner stad scène simplement impensable gomer bukavu gen vivre paix fon
1134755816135888896,ne y conflit fuyulu tshisekedi fils ne être vouloir alliance fcc
1134755811606106113,agreed mate
1134755773878341632,an de exil le opposer antipas mbuser nyamwisi rentrer vendredi présent présent
1134755766483783680,dimanche matin rfi le émission changement politique
1134755731284959232,dhs insider eed us migrant made user confirmed case ebola custody
