,cleanned_tweet
1134772944880721920,publier truc pareil donner nom le entreprise faute commettre
1134772939189116928,coalition lamuka éclater ce être cadavre frémit
1134772938991898625,décrispation mbuser nyamwuisi fin long exil
1134772925293375488,fatiguer .. vraiment proche prévoir action chinois
1134772897761955840,effet accueillir amour joie commencer kinshaser
1134772848352989184,affaire sassou inquiet etre chasser prison dieudonné antoin ganga justice réparater p
1134772842401157120,planting adopting treer great see
1134772839146500098,cameroon guy say afghan iraq iran terror present
1134772829566582784,children fiv dying higher rate ebola epidemic
1134772829398810624,obsèque étienne tshisekedi principal opposant absent « possible » présence kabila
1134772798541520896,tunisie final créteil remontader spectaculaire rd bravo frérot yas
1134772779524460544,visit president kagame democratic republic kinshaser june
1134772776823382016,affaire sassou inquiet etre chasser prison dieudonné antoin ganga justice réparater p
1134772775007207425,espère sincèrement faire sorte retrouv grandeur delà congol
1134772747794563072,chute mabafi niari république chezmoiaucongo visiterlecongo
1134772743814221824,pouvoir mobiliser revendiquer droit
1134772699987947520,vou falar duer ele liderou com êxito força da onu e haiti e voc
1134772668283138048,fevoco beachvolley présent cap vert pair patience tshama eliege makumbu représenter
1134772666207019008,également disponible français urgent intervenant international utiliser leçon tirer
1134772658149761024,unpopular opinion one best english speaker naija
1134772657155653632,ituri may female engagement team fet monusco force bangladeshi rapid deployment battal
1134772652638441472,last night u border patrol agent apprehended illegal alien angola cameroon near u
1134772638629466112,dhs insider eed us migrant made user confirmed case ebola custody
1134772631805333504,obsèque de étienn tshisekedi principal opposant absent possible présence kabila
1134772591456137217,trier uno di noi creer nuovi disoccupati e fa crollare salari quota diminuisce occupazione
1134772565300404225,polémique coût obsèque de etienne tshisekedi enfler heure retour annoncer dépouill kinshaser
1134772556593094656,rdc  bad accord financement million usd juin juillet
1134772544593104897,friday thousand mourner gathered kinshaser pay tribute lat etienne tshisekedi iconic oppo
1134772504965386240,dhs insider eed us migrant made user confirmed case ebola custody
1134772496853544960,tshisekedi décoré samedi « héro national » programme officiel
1134772493015834624,u border patrol agent assigned del rio sector apprehended large group individual angola cameroon
1134772489148686336,obsèquesetshisekedi président féli  antoine tshisekedi denis sassou ne guesso participer
1134772467346661376,ethnie non que être ce ce être voire seul pays conflit eth
1134772467321491457,photodujour goma monusco général corps armée elia rodrigue martin filho commandant
1134772435864248321,last night u border patrol agent apprehended illegal alien angola cameroon near u
1134772429312659456,employer chinois de un société chinois baser kambove film chef train frapper employer
1134772426183716864,accolader félix tshisekedi notamment albert yuma samy badibanger matater ponyo
1134772421943209984,cifor looking relatif importance wild meat insects fish seasonal relationships di
1134772417153253378,complice malheur partenaire rwanda soutie
1134772413885927425,u border patrol agent assigned del rio sector apprehended large group individual angola cameroon
1134772404914446336,opposant exclure hommage officiel étienne tshisekedi
1134772404457226242,espère ministerejusticerdc déjà saisir affaire enquêt
1134772319254188032,ver olivenza desd el aire una eeriencia alucinant ven perfectament las antiguer muralla forma estrella
1134772314992545793,white bol international airport way democratic republic representing heure e
1134772300904042496,kagame ovationner stad scène simplement impensable gomer bukavu gen vivre paix fon
1134772261511139333,conférence état partie convention relatif droit handicapé douzième session new york
1134772260328431616,accolader félix tshisekedi notamment albert yuma samy badibanger matater ponyo
1134772242997530625,obsequestshisekedi le arrivée président cérémonie de hommage démarrer
1134772204137304064,félix tshisekedi arrivé stade prendre temps saluer différent invité
1134772190614872064,notare che neanch lo citano più sto logo lo vogliamo cambiare mettiamo quello della lega e tanti
1134772164488507392,bienvenu leader jeuness africain welcome bos
1134772159732228097,arriver stad martyr incliner dépouill de etienne tsh
1134772142887882754,yerodia ndombasi élevé grade grand cordon ordr national héros kabila  lumumba
1134772138127347713,arrival president desmartyr stadium rest peace former president dr e tshiseke
1134772129772265472,ne as user moyen atteindre seul le amour primer
1134772128975335424,crpd convention relatif droit handicapé groupe travail présession sept
1134772115050307584,hier paul kagame diaboliser étienn tshisekedi paire aujourd'hui criminel de hier aduler ud
1134772113817112577,étienn tshisekedi admettre titre grand cordon le ordre national héros national kabila  lumumba
1134772110998626306,obsequestshisekedi eh oui chef pleurer célébrer ce être le honorer
1134772044158181376,last night u border patrol agent apprehended illegal alien angola cameroon near u
1134771975870734336,saluon vivement compassion féliciton président relation voisin
1134771966261334016,one poorest countrier one poorest region refugee welcome people littl boire
1134771965275856896,garde corps de etienne tshisekedi man
1134771947735277569,dernier jour obsèque étienne tshisekedi stad martyr parmis gouverneur note présence gouv
1134771940500156416,great photo date dianfossey first safari africa visited tsavo kenyer
1134771899752431616,connaissaient résidence limete aller invité bantus occidentaliser ceu
1134771891976179712,lamuker el kinshaser el katanga
1134771891028320256,bankers club banquier exbanquier assureur imf welcome space exchange eerienc
1134771819754467328,hero national
1134771800074805248,image invraisemblable venir sembler t il personne film sembler parler chinois effet
1134771791422001152,garde corps de etienne tshisekedi man
1134771783628926976,total case confirmed case confirmed deaths drcongo' s largest  ever known ebola outbreak read
1134771759822123009,bruxelle di maio tria neller letterer tagli savoir reddito di cittadinanza quota e welfare trier e ch cazzo
1134771751035047936,stade martyr incroyable réhabilitation paul kagamé
1134771749424422914,« chef etat convenir renforcer axe angola rwander trouver voie moyen
1134771731774808064,hier paul kagame diaboliser étienn tshisekedi paire aujourd'hui criminel de hier aduler p
1134771646357786625,obsèquesetshisekedi président féli  antoine tshisekedi denis sassou ne guesso participer
1134771635121270784,u border patrol agent assigned del rio sector apprehended large group individual angola cameroon
1134771614627893250,quindi io che qualch volta pago con postepay non ho potrei essere svergognato sui social
1134771596709834752,rwanda  drc  angola
1134771591076864000,obsèquesetshisekedi président féli  antoine tshisekedi denis sassou ne guesso participer
1134771522336374784,abdou diouf justin bomboko christophe gbennye également grand coordon
1134771503155691520,one poorest countrier one poorest region refugee welcome people littl boire
1134771474173169664,départ chef de état applaudissement population vidéo
1134771390819835904,activists say oil eloration new block uganda could negatively affect local communitie depend ecos
1134771343063441409,président félix tshisekedi promet rapatrier également dépouill marechal mobutu ses seko decrispati
1134771282447405056,arrival president desmartyr stadium rest peace former president dr e tshisekedi udp
1134771267431796737,paul kagame kinshaser rendre hommage tschisekedi père
1134771265779228673,obsèquesetshisekedi président rwandais paul kagame incliné dépouill feu etienne tshiseke
1134771251027894272,image invraisemblable venir sembler t il personne film sembler parler chinois effet
1134771228449890304,news otohô de oyo champion èm consécutive qualifier leagu champio
1134771188104945664,taux chômage combien travailler
1134771177430429696,tunisie final créteil remontader spectaculaire rd bravo frérot yas
1134771097927344128,dhs insider eed us migrant made user confirmed case ebola custody
1134771055720042506,na
1134771039504949248,u border patrol agent assigned del rio sector apprehended large group individual angola cameroon
1134771037940441088,bienvenu leader jeuness africain welcome bos
1134771036111736834,
1134771027777597441,bel image malheureusement politique iceberg vérité ne être forcément
1134771022757015552,tentative manipulation tribal nord_kivu jrs le élection de un nouveau gouver
1134771018499854337,bruxelle di maio tria neller letterer tagli savoir reddito di cittadinanza quota e welfare trier e ch cazzo
1134771017128337409,etienne tshisekedi « peuple abord » testament génération vue
1134770945883873280,
1134770939575570432,
1134770914690621445,unless monster priti patel get way
1134770877625769984,applaudi arrivée stad martyr rwanda
1134770860617850881,marche blanc nzodjou fotsing libérer bref interpellation conduire gmi manifester
1134770836462854144,garde corps de etienne tshisekedi man
1134770802610642944,hell anybody walk way acros ocean even carrying baby deserv
1134770798412161026,bruxelle di maio tria neller letterer tagli savoir reddito di cittadinanza quota e welfare trier e ch cazzo
1134770788484206592,vent grand baobab restera jamais coeur
1134770766019530753,interesting look like diabete incidence declining since us prevalence remained stable heure
1134770751842787328,zim economy going since teker dongo day biggest problem
1134770740207792128,u border patrol agent assigned del rio sector apprehended large group individual angola cameroon
1134770726362406912,per economist kabiler yet vacate presidential viller handover plane tshisekedi thro
1134770717051035649,déranger internaute loin dire
1134770689033089025,last night u border patrol agent apprehended illegal alien angola cameroon near u
1134770680405401600,félix tshisekedi arrivé stade prendre temps saluer différent invité
1134770677515522048,obsequestshisekedi le arrivée président cérémonie de hommage démarrer
1134770676680671232,etienne tshisekedi « peuple abord » testament génération vue
1134770655575064577,rendre hommage etienne tshisekedi wa mulumba acteur politique majeur grand combattant lutter p
1134770648776138752,gros dé appel nigeria pékin alsace
1134770636704718848,dangerous country women afghanistan syria somalia saudi arabier
1134770602584264706,image invraisemblable venir sembler t il personne film sembler parler chinois effet
1134770590848389120,
1134770583361769472,
1134770582447362048,ebola rumormitigation communityengagementandaccountabity redcross croixrouge
1134770549727596544,felixtshesekedi president arriver stadium funeral ceremony father lat etiennetshisekedi
1134770523823583233,kagame ovationner stad scène simplement impensable gomer bukavu gen vivre paix fon
1134770505851002880,société chinois baser kambove agent commettre erreur travail large diffusion afin autorité
1134770504319897600,quoi merde coach quoi injustice jouer afrique sud senegal
1134770483977699328,dhs insider eed us migrant made user confirmed case ebola custody
1134770481494671360,femal boxer fighting back
1134770463769616384,envie voir twit propos mener prer
1134770448347144192,détest eression « chance » malchance cell
1134770411688910848,suppose information
1134770388955803649,impression majorité intéresser football france espagne
1134770369049563136,laïc bon aliniement homme safari insulte télé homme monsengwo membre
1134770348807917568,lualaba kolwezi constat place nombreux réalisation chantier se activer vigueur
1134770328423542789,one poorest countrier one poorest region refugee welcome people littl boire
1134770321045753858,osm opendater logicielslibre afrique actionosmbrazzavill petit pause famill joyeux troup
1134770294844022784,nyirarukundo' s face say armed men attacked family democratic republic nyirarukundo ran one way heure
1134770270420578304,one poorest countrier one poorest region refugee welcome people littl boire
1134770262874959872,tunisie final créteil remontader spectaculaire rd bravo frérot yas
1134770234395713536,etienne tshisekedi admettre titre posthume le ordre national héros national kabila  lumumba
1134770210760744961,yerodia ndombasi élevé grade grand cordon ordr national héros kabila  lumumba
1134770163922939904,cazzari andranno pedate nel sedere e tutti questi ignoranti ch insultano buon
1134770157530886144,one poorest countrier one poorest region refugee welcome people littl boire
1134770151054893056,know word berbaque hausa word babbak hausa people user term babbake mean sin
1134770138207727617,dernier jour obsèque étienne tshisekedi stad martyr signaler présence gouverneur
1134770131727540224,prof mbata tshisekedi grand combattant démocratie etat droit indépendance
1134770123859009536,sufre epidemia má letal savoir historia ya hay má muertos por ébola desd el último brote desconfia
1134770104040939520,zacharie badiengila alias mwander nsemi présent obsèque de étienn tshisekedi
1134770095618760704,imagine fleeing night imagin knowing next meal would imagin born war zone imagin
1134770092158439424,skillez tweet
1134770091361472512,coopopopé moni
1134770088865861632,latest short analysi mak islamic stater claim
1134770083778170881,exactement coalition lamuka bande médiocre
1134770056087445504,groupe total accuser mettre danger biodiversité républiqu démocratique chercher pét
1134770044368490496,last night u border patrol agent apprehended illegal alien angola cameroon near u
1134770032238649345,coeur peuple honor héros hommage mériter rendre étienn tshisekedi rappe
1134770026144251904,manqu kabilie médiocre satanique criminel sanguinaire malheur
1134770006439485441,gabriel kyungu wa kumwanzer présent obsèque de étienn tshisekedi
1134769994833760257,u border patrol agent assigned del rio sector apprehended large group individual angola cameroon
1134769990996058112,etienne tshisekedi buried dr
1134769967268843525,etienne tshisekedi admettre rang grand cordon le ordre national héros national kabila  lumumba
1134769921915793408,wish fellow kenyan great madaraka day democratic republic represer president
1134769894816399360,félix tshisekedi malédiction rd inviter paul kagame bourreau chef obsèqu
1134769821760086016,groupe total accuser mettre danger biodiversité républiqu démocratique chercher pét
1134769792903196673,u border patrol agent assigned del rio sector apprehended large group individual angola cameroon
1134769757125861376,malheureusement le histoire pays écrire de autre donné forme fon
1134769745243398144,le ua aller annuler élection franchement argument tirer
1134769698770493440,felixtshesekedi president arriver stadium funeral ceremony father lat
1134769685726191616,south african president heure e swowed path african leader choosing cabinet women partici
1134769667669708801,bueno depend sud africa el norte pero el todo eso loco
1134769652062490625,croire etat islamique fièvre passager détromper  vous cancer djihadiste installer durablem
1134769638372515841,el ébola ha dejado ya muertos una epidemia una magnitud todavía desconocida hablamo con el
1134769614859198464,latest short analysi mak islamic stater claim
1134769592935391232,vikku
1134769575323680768,président rwandais paul kagame le invité surprise cérémonie organiser rd rendre hommage
1134769559213367296,non è stato le oscurantismo eh secondo voi è normal che per
1134769558626156544,applaudi arrivée stad martyr rwanda
1134769515831713792,accolader félix tshisekedi notamment albert yuma samy badibanger matater ponyo
1134769501352996872,garde corps de etienne tshisekedi man
1134769484026261504,etienne tshisekedi admettre rang grand cordon le ordre national héros national kabila  lumumba
1134769458805915648,femme victime viol guerre reconstruire prixnobel fondationpanzi eition  v
1134769440560746497,territoir beni offensif victorieux fardc jeudi mai heure matin combattant adf
1134769436412514304,president kagame pays respect lat etienne tshisekedi former prime minister democratic republic con
1134769435745669120,bjr mr ne être fayulu haineux demander kagame venir vérité
1134769426518204416,dhs insider eed us migrant made user confirmed case ebola custody
1134769410181349376,obsèquesetshisekedi président rwandais paul kagame angolais joão lourenço rendre hommage feu etienn
1134769381441974273,ye
1134769375939104768,samedi juin jour de enterrement de étienn tshisekedi vidéo
1134769368473178112,etienne tshisekedi admettre titre posthume ordre national héros national kabila  lumumba grade gr
1134769368129298438,dhs insider eed us migrant made user confirmed case ebola custody
1134769360206086144,drc_romaneeconti psid _ _
1134769313779503104,réunir famille victor réfugier
1134769307471269888,nouveau réserve lola ya bonobo ong dédier protection bonobo
1134769302052188160,arriver stad martyr incliner dépouill de etienne tsh
1134769274508255232,south african president heure e swowed path african leader choosing cabinet women partici
1134769229125885953,etienne tshisekedi élevé statut héro national inhumation jeudi
1134769206254297088,dhs insider eed us migrant made user confirmed case ebola custody
1134769199384018946,abbraccio insolito è quello che andré bauma capo custod del centro senkwekwe per gorilla orfani nel parco nazional
1134769179943477248,image président comité politique excellence compagni président
1134769176030208001,u border patrol agent assigned del rio sector apprehended large group individual angola cameroon
1134769174281146368,etienne tshisekedi admettre rang grand cordon le ordre national héros national kabila  lumumba
1134769169067585538,programme officiel prévoit bel élévation tshisekedi statut héro national
1134769071281455104,tshisekedi principal opposant absent hommage officiel étienne tshisekedi
1134769061974466560,rdcongo meilleur manière de honorer mémoire feu dr étienn tshisekedi wa mulumba ce être pérenniser idéal
1134769054927937536,final anglais soir uclfinal affront présentation
1134769053074186240,
1134769051769565185,u border patrol agent assigned del rio sector apprehended large group individual angola cameroon
1134769018647318529,lorsque noir déclarer blanc inutile de échanger valeur principe changer
1134769014029332480,congolese force killed rebel democratic republic congo' s east ebola zone thought linked isla
1134768971981447169,ownnn ele são fofo
1134768955904745473,¡ nuevo reto directore deportivos por día youtube chiringuitoinsid ¡ lo
1134768954126295040,félix tshisekedi malédiction rd inviter paul kagame bourreau chef obsèqu
1134768946157096960,président républiqu félix  antoin tshisekedi tshilombo signer mai le ordonnance porter admission
1134768933846827008,
1134768926611689473,awoke morning fabulous view ubangi river largest right  bank tributary river u
1134768916474019840,last night u border patrol agent apprehended illegal alien angola cameroon near u
1134768915689693185,dépouill mortel président etienne tshisekedi arriv terre ancêtre fier de avoir côté
1134768912309084160,arriver stad martyr incliner dépouill de etienne tsh
1134768862464028672,last night u border patrol agent apprehended illegal alien angola cameroon near u
1134768849914667010,société chinois baser kambove agent commettre erreur travail large diffusion afin autorité
1134768809280200706,ebola onu engager intervention urgence travers monusco
1134768784856768513,frère baiss prix passeport veux dépenser acheter u
1134768777025982464,etienne tshisekedi admettre ordre national héros national kabila  lumumba grade grand cordon offic
1134768770273226752,
1134768733132599296,new post etienne tshisekedi désormais héro national
1134768724169412609,rude
1134768688966643712,people angola etc muslims they' r christians usually
1134768688354209794,last night u border patrol agent apprehended illegal alien angola cameroon near u
1134768686261297157,demande étienne tshisekedi pèr démocratie rdcongo albert moleka répondre
1134768668674535424,an grincement dental féli antoin tshisekedi tshilombo président républiqu démocrer
1134768667827343360,arriver stad martyr incliner dépouill de etienne tshisekedi
1134768667298795520,last night u border patrol agent apprehended illegal alien angola cameroon near u
1134768589695782914,u border patrol agent assigned del rio sector apprehended large group individual angola cameroon
1134768543986278400,dernier jour obsèque étienne tshisekedi stad martyr parmis gouverneur note présence gouv
1134768509102186497,breaking ebola concern texa illegals cross border u
1134768488529178624,valoir mieux
1134768485366751232,u border patrol agent assigned del rio sector apprehended large group individual angola cameroon
1134768475983888384,dernier jour obsèque étienne tshisekedi stad martyr parmis gouverneur note présence gouv
1134768475862437888,dernier jour obsèque étienne tshisekedi stad martyr parmis gouverneur note présence gouv
1134768454802837504,pouvoir contract sdc freight might well wearing cement shoer f
1134768430744309760,one poorest countrier one poorest region refugee welcome people littl boire
1134768426277396480,source généralement informer joseph kabila coalition front commun
1134768392005722112,tunisie final créteil remontader spectaculaire rd bravo frérot yas
1134768385512923139,empêcher retour katumbi insister auprès pouvoir place
1134768361622200321,one sanctuary runner marie
1134768343855063040,tunisie final créteil remontader spectaculaire rd bravo frérot yas
1134768321038082048,visite culturelle touristique permettre de un centaine de élève prendre connaissance histo
1134768301144465408,è ridare dignità alle persone siete fuori strader per lo meno per come dignità
1134768254428352512,last night u border patrol agent apprehended illegal alien angola cameroon near u
1134768215752663040,image président comité politique excellence compagni président
1134768162728284161,président vient de arriver stade martyr
1134768150606729217,dhs insider eed us migrant made user confirmed case ebola custody
1134768145208680448,retour hier marin  pompier intervenir feu garage de un villa
1134768120516816898,tunisie final créteil remontader spectaculaire rd bravo frérot yas
1134768115609477120,rediff lir congocrisi lesaviezvous devoirdemémoir corruption kinshasa new  transkin
1134768106881110017,dépouille de etienne tshisekedi retour rdcongo an mort disparaître influence reste ex
1134768064065679360,eepreddito di cittadinanzer una riforma necessaria difficile da realizzare
1134768063734263808,
1134768042167144449,etienne tshisekedi admettre titre posthume le ordre national héros national kabila  lumumba
1134768030603456512,
1134768025268174854,flagoftheday fotd flag people' s republic country called republicofth
1134768019379560448,è saltato all' ultimo minuto dopo mistero della bozza inviater anteprima aller stampa probabilment da qualch man
1134767996977799168,zacharie badiengila alias mwander nsemi présent obsèque de étienn tshisekedi
1134767935552151553,président félix tshisekedi journée stad martyr le hommage rendre le opposer histori
1134767929164218369,total case confirmed case confirmed deaths drcongo' s largest  ever known ebola outbreak read
1134767917676093440,rediff lir congocrisi lesaviezvous devoirdemémoir corruption kinshaser kinshaser
1134767900164837378,kinshasa 1955  1965 photographed jean deparer
1134767887242158080,kindoki ezali volonté motema mab ezali domain ya ba assister na matanga distribué invit
1134767878098567170,urgent invite kinoi venir nombreux stade martyr le entrée libre gratuite
1134767875590447104,eression reconnaissance merci grand équateur le amour considération soutien témo
1134767832988864513,dieu feron eloits vif fatshi
1134767830245789696,well done
1134767815418945536,dernier jour obsèque étienne tshisekedi stad martyr parmis gouverneur note présence gouv
1134767811748925440,
1134767760418975747,coeur rendre dernier hommage étienn tshisekedi héro politique marquer
1134767747605438464,vien de arriver stad martyr kinshaser assister obsèque officiel le ancien premier ministre
1134767741313806336,
1134767673026461697,ebola new case death community
1134767651589447680,acteur politique hypocrite lire commentaire un feu tshisekedi
1134767607557607431,tshisekedi principal opposant absent hommage officiel étienne tshisekedi
1134767579518685184,le europe
1134767577706745856,kinshaser hier soir faustin archange touader aller se incliner samedi dépouille tshi
1134767554231177217,rendre hommage etienne tshisekedi wa mulumba acteur politique majeur grand combattant lutter p
1134767539911876608,rwanda angola africawewant
1134767539727339520,
1134767526985048064,pero ver chaval tú utilizas seguridad social
1134767485943734272,one poorest countrier one poorest region refugee welcome people littl boire
1134767483259428865,dr etiennetshisekedi te avoir voter pck savai vraiment incarnai pays resp
1134767379404283904,adresse tout compassion président félix tshisekedi ainsi ensembl famille défunt jour
1134767359133134848,non ce è le hanno magari percher le hanno valutater e hanno deciso che era iniqua tipo
1134767353491808256,bâtiment administratif cns peau neuf
1134767345770160128,étienn tshisekedi admettre titre grand cordon le ordre national héros national kabila  lumumba
