,cleanned_tweet
1134782998988173313,samedi er juin chef etat e féli  antoin tshisekedi tshilombo arrivé stad martyr
1134782997830541315,pendant rép felix antoin tshisekedi tshilombo venir signer le ordonnance porter référence mai
1134782980398956544,children fiv dying higher rate ebola epidemic
1134782977592954883,awesome thread year army officer led private security iraq afghanistan
1134782938850217992,demande rechercher Monsieur joseph kabiler partout territoir na
1134782930650390528,obsèquesetshisekedi président rwandais paul kagame incliné dépouill feu etienne tshiseke
1134782909959815168,pbl vox cercueil grand cordon katumba
1134782888287883265,new rwanda  drc  angola axis born kinshaser
1134782879077163009,saviez de après étude sérieux er scientifique cambrioler sylvain pierre duriff jaune
1134782848668446720,tripartitensele photodefamill issu réunion tripartite président rwandais angoler
1134782826904244226,bracongo recrute comptable paie immobilisation
1134782782000050176,obsèquesetshisekzdi arriver inster président centrafricain e faustin  archange touadéra
1134782776908099584,félix tshisekedi porte comité organisateur obsèque insister que étienn
1134782767374450690,article nouveau rapport covertcapital
1134782734528897024,pendant rép felix antoin tshisekedi tshilombo venir signer le ordonnance porter référence
1134782729302806529,afrique précisément républiqu démocratique capital kinshaser
1134782717172899840,host th conference city mayors great lake region burundi rwanda find
1134782680523034624,coeur rendre dernier hommage étienn tshisekedi héro politique marquer
1134782676643262464,r hon florence nambozo deputy national commissioner patriotism mr mubarak magomu sironko isaac lulaba
1134782651494215680,first mettre etienne tshisekedi u charger de affaire kinshasa consider fathe
1134782643676090369,u border patrol agent assigned del rio sector apprehended large group individual angola cameroon
1134782627452526592,tunisie final créteil remontader spectaculaire rd bravo frérot yas
1134782627259588609,forcé corps vie le exil pavaner le aéroport accueillir dépouill mortel
1134782605805727744,kagame former bodyguard murder detail emerg rwandan congolese top foreign national crim list ugandan
1134782589062066176,peuple rdcongo rendre vibrant hommage étienn tshisekedi le un principal leader politique depui
1134782588567072768,arrivée inster président zambien e edgar lungu stade martyr
1134782581264834561,dision fort le ennemi ce être frère actuellement
1134782569399144448,ouiii parlant amnésie rappellez  vs final kigali coupe africain foot chan gagn stad plei
1134782567775948800,ver olivenza desd el aire una eeriencia alucinant ven perfectament las antiguer muralla forma estrella
1134782534179594245,henriette wamu wivin moleker également présenter obsèque de étienn tshisekedi
1134782522724716544,..
1134782516148224002,tunisie final créteil remontader spectaculaire rd bravo frérot yas
1134782500004343808,paulkagame reached return criminality according mappingreports killed million
1134782490688806912,également présent stad martyr trois jour kinshaser
1134782480119209985,week' s editorial cartoon
1134782472032530434,yrs ago cpt diagne senegal killed serving rwander risked everything saving civilian live
1134782454345216000,étienn tshisekedi « grand cordon » non « héro national » tribun
1134782348497760256,etienne tshisekedi élevé rang grand coordon landrsquoordre héros national kabila  lumumba
1134782338305593344,
1134782274820612097,président comité politique participer vendredi mess mémoir eremier ministre
1134782261310709760,lutte continue.le pèr démocratie tchisekedi rester graver mémoir toujour inscri
1134782260106989569,
1134782225713631232,obsèque e tshisekedi prêtre catholique incliner cercueil tshisekedi
1134782210240843777,today bring twenty  seventh part daily ramer ān companion urgent app
1134782173062586370,yar ye cheating hy otherwise
1134782146219040768,dangerous country women afghanistan syria somalia saudi arabier
1134782141387218944,félix tshisekedi malédiction rd inviter paul kagame bourreau chef obsèqu
1134782138904170496,talking ebola vaccine delivered million ye people sc
1134782113646088192,menteur service mal
1134782112677138433,day afcon moment later hat  trick extra time scored bernard chanda zambia
1134782111955804160,u border patrol agent assigned del rio sector apprehended large group individual angola cameroon
1134782096856276992,obsèquesetshisekedi président féli  antoine tshisekedi denis sassou ne guesso participer
1134782068251090944,proud coeditor together fantastic blog series urban insecurity eastern
1134782062391635969,lesaviezvous devoirdemémoir yerodia ndombasi élevé grade grand cordon ordr national
1134782028984082432,tchad afrique francafriqu togo algerie mali faso toulous cotedivoire kebetu
1134782027633516544,tchad afrique francafriqu togo algerie mali faso toulous cotedivoire kebetu
1134782012156514308,headed home mpc w grateful heart made conference success thank
1134781998994735104,last night u border patrol agent apprehended illegal alien angola cameroon near u
1134781996725653504,ce être le école joue aimé jeune reporter le être rd le équation simple élè
1134781992627818496,paulkagame reached return criminality according mappingreports killed million
1134781978732060672,utiliser dépouille sphinx monnayer de échang gâteau opportunité réconciliation rwanda
1134781955936018433,angola rwanda réunion tshisekedi kagame lourenço marge cérémonie hommage vouloir renforce
1134781953272680448,u border patrol agent assigned del rio sector apprehended large group individual angola cameroon
1134781914215264256,u border patrol agent assigned del rio sector apprehended large group individual angola cameroon
1134781909236686849,rdcongo dépouill de etienne tshisekedi figure historique opposition pèr le actuel président arrivé
1134781892396507136,arrivée inster président zambien e edgar lungu stade martyr
1134781874440691712,comment chrystal clear africa wake recommend dr starting thanks president putin
1134781870548410370,abbraccio insolito è quello che andré bauma capo custod del centro senkwekwe per gorilla orfani nel parco nazional
1134781847492317185,committed panafricain multilateral bank willing abl implemer change trade local content
1134781784078659586,rdc  rwanda responsable crime commettre citer mappingreports devoir recevoir tapi
1134781780974800896,u border patrol agent assigned del rio sector apprehended large group individual angola cameroon
1134781760477306881,kinshasaentr émotion joi population congolais rendre dernier hommage tshisekedi wa mulumba
1134781749198774273,epidemia di ebola rischia di espandersi uganda e rwanda essendo gia arrivater gomer e sud sudan sen
1134781740684328960,rd congole chinois racheter société tenke fungurume mining hautkatanga désengager eatrier
1134781732027281409,félix tshisekedi marionnette réserver kagame continuité le occupation cong
1134781726146867203,dhs insider eed us migrant made user confirmed case ebola custody
1134781687764795393,tripartitensele photodefamill issu réunion tripartite président rwandais angoler
1134781672061317120,obseque etienne tshisekedi président républiqu zambi stad martyr
1134781668894695424,ce être journer tristess montre combien long chemin reconstruction
1134781649554722816,monday peopl died ebola concerningly vast majority new confirmed case
1134781636921495553,last night u border patrol agent apprehended illegal alien angola cameroon near u
1134781634945855488,u border patrol agent assigned del rio sector apprehended large group individual angola cameroon
1134781626091737088,programme juin jour le enterrement étienne tshisekedi wa mulumba
1134781624959361024,white bol international airport way democratic republic representing heure e presiden
1134781598103212033,exactement chéri rep
1134781514636517376,ptdrrrrrr
1134781503966261248,garde corps de etienne tshisekedi man
1134781500799541249,obsèque tshisekedi e hautkatanga gouverneur présent stad mart
1134781487604215808,breaking ebola concern texa illegals cross border u
1134781483720290304,dhs insider eed us migrant made user confirmed case ebola custody
1134781474807459840,obsequestshisekedi cérémonie de hommage venir commencer stad martyr
1134781460047630336,map mande nouveli mete kontrol sou jan nouveau yo ap soti pou imaj ayiti li rapote ajan espagnol efe di ke prez
1134781438904156160,mali sénégal ce être
1134781420218531840,comédi commence réaliser petit petit
1134781418616303616,obseque etienne tshisekedi président républiqu zambi stad martyr
1134781410689081344,président comité politique participer vendredi mess mémoir eremier ministre
1134781406738075648,zacharie badiengila alias mwander nsemi présent obsèque de étienn tshisekedi
1134781404074663936,national amnesia poor leadership impact future nation.drc rwanda' s kagame star tshi
1134781324831657984,wish fellow kenyan great madaraka day democratic republic represer president
1134781313532215297,last night u border patrol agent apprehended illegal alien angola cameroon near u
1134781275368304641,u border patrol agent assigned del rio sector apprehended large group individual angola cameroon
1134781256863014914,abbraccio insolito è quello che andré bauma capo custod del centro senkwekwe per gorilla orfani nel parco nazional
1134781247685824517,u border patrol agent assigned del rio sector apprehended large group individual angola cameroon
1134781243369885697,piece wrote katwa working ebolarespons msf behind every ebola cas people
1134781198587367425,etienne tshisekedi désormais héro national rdcongo
1134781176533659648,de accord que on scruter le arrivée kabila stad rdcongo hommagesofficiel
1134781147450413057,u border patrol agent assigned del rio sector apprehended large group individual angola cameroon
1134781139330244611,kindoki ezali volonté motema mab ezali domain ya ba assister na matanga distribué invit
1134781135244992513,ebola concern texa illegals cross border us usaid on
1134781134804574210,marthe kasalu jibikilayi venir de arriver stade martyr
1134781114604752897,méchant
1134781096388964352,one sanctuary runner marie eager show lovely pictur today think
1134781090378506240,programme juin jour le enterrement étienne tshisekedi wa mulumba
1134781068807217154,day afcon moment later hat  trick extra time scored bernard chanda zambi
1134781066965917696,lober nanu ata ko yo moko matanga
1134781059953037313,tripartitensele photodefamill issu réunion tripartite président rwandais angoler
1134781047630114817,ba za important
1134781034724253696,dernier jour obsèque étienne tshisekedi stad martyr parmis gouverneur note présence gouv
1134780964209659904,dhs insider eed us migrant made user confirmed case ebola custody
1134780962938773507,kuzuuu hayirdir senin vatandasin kim soylu erdoganin ulkesi sende vatandasim sener senin kulag
1134780958593474560,valoir mieux
1134780958379560960,président zambien edgard lungu également présent stade martyr
1134780930613174272,u border patrol agent assigned del rio sector apprehended large group individual angola cameroon
1134780929359171584,comment chrystal clear africa wake recommend dr starting thank presiden
1134780904126197760,dhs insider eed us migrant made user confirmed case ebola custody
1134780903308312576,caminha para ser
1134780851194146816,rendre hommage etienne tshisekedi wa mulumba acteur politique majeur grand combattant lutter p
1134780823796944897,arrivée inster président zambien e edgar lungu stade martyr
1134780805774020608,tour_du_cameroun èr étape cours akonolinga abong mbang coureur neuf équipe devoir p
1134780722554818561,today bring twenty  seventh part daily ramer ān companion urgent app
1134780717798477824,respecter boulot udjana important pays tâche
1134780709619556352,réunion tshisekedi kagame lourenço marge cérémonier
1134780697741352960,captured last night freaking
1134780635216850944,gouverneur présent kinshasa obsèquesetshisekedi excellence
1134780626706608128,flutter hack brazzavill hack
1134780619408465920,obsequestshisekedi maman marthe venir de arriver stad martyr assister hommage étienn tsh
1134780567621382144,u border patrol agent assigned del rio sector apprehended large group individual angola cameroon
1134780559627096065,cérémonie hommage étienn tshisekedi se être tenir vendredi mai stad martyr kinshaser mé
1134780500688527360,
1134780492463706112,last night u border patrol agent apprehended illegal alien angola cameroon near u
1134780478475689984,hier sache changer
1134780474935656449,président zambien edgard lungu également présent stade martyr
1134780464730923008,week' s editorial cartoon
1134780457801912320,last night u border patrol agent apprehended illegal alien angola cameroon near u
1134780456786939904,las teoría ocultan tra segunder mayor epidemia ébola del historia
1134780368014467073,rdcongo inviter le émission politique demokrasia na siyasa radio iriba fm 90.0 merci
1134780319125704705,président républiqu felix antoin tshisekedi tshilombo venir signer le ordonnance porter référence
1134780319037624320,le ano ft gaff méchant
1134780257863577600,
1134780251106631680,henriette wamu wivin moleker également présenter obsèque de étienn tshisekedi
1134780246190747648,5 m
1134780240297975808,être ce président républiqu honoraire viendra
1134780230990798848,u border patrol agent assigned del rio sector apprehended large group individual angola cameroon
1134780205787205632,talking ebola vaccine delivered million ye people sc
1134780202167521285,rnalista abogada e activista polo dereitos da muller premio príncipe asturia caddy abzuba
1134780197700624385,malade mr le agent justice se occuper type
1134780192935862272,new rwanda  drc  angola axis born kinshaser
1134780192688418816,las teoría ocultan tra segunder mayor epidemia ébola del historia
1134780158957772800,one poorest countrier one poorest region refugee welcome people littl boire
1134780152032964608,shout activists plan take corruption champion transparency corruption enemy
1134780135188471808,one poorest countrier one poorest region refugee welcome people littl boire
1134780116360470530,tofulaner ce être promouvoir encourager déjà sondag aller sen
1134780077076385792,5  6
1134780074216087552,ebola seuil cas presque franchir
1134780058936184832,tshisekedi principal opposant absent hommage officiel étienne tshisekedi
1134780026967040000,
1134780024534552576,caminha para ser
1134780011477647366,tour_du_cameroun èr étape cours akonolinga abong mbang coureur neuf équipe devoir p
1134779990732562433,friday thousand mourner gathered kinshaser pay tribute lat etienne tshisekedi iconic opposition lea
1134779989990236160,aller rappeler force mobutiste guerre pool allez arrêter parler cong
1134779981182017536,
1134779972168630273,africans graduated negro status alien according disrespectful human kind
1134779941382434816,bana déjà regarder film « habit neuf gouverneur » film spécia
1134779939406995457,obsèque e tshisekedi millier prendre assaut stad martyr samedi
1134779921056899074,jamais troupe congolais zaïre le inverse ne être vrai position victimair
1134779895480033280,président zambien également venir de arriver chef le état brazzavill
1134779880787234816,
1134779872822382592,caminha para ser
1134779870066675712,committed panafricain multilateral bank willing abl implemer change trade local content
1134779863196475392,etienne tshisekedi admettre titre posthume ordre national héros national kabila  lumumba grade gr
1134779843214741505,u border patrol agent assigned del rio sector apprehended large group individual angola cameroon
1134779841197355008,opposant absent hommage officiel étienne tshisekedi
1134779822448812032,tour_du_cameroun èr étape cours akonolinga abong mbang coureur neuf équipe
1134779821987454977,equipes analyste politicien comprendre magazine br
1134779820112535552,obsèquesetshisekedi président féli  antoine tshisekedi denis sassou ne guesso participer
1134779779113259009,capoeirer tool liberation martial art helping youth
1134779757365747713,sassou nguesso arrivé stad martyr
1134779752986882048,tripartitensele photodefamill issu réunion tripartite président rwandais angoler
1134779742299799554,rappel assister final écran géer samedi er juin partir heure afr
1134779739116380160,félix tshisekedi malédiction rd inviter paul kagame bourreau chef obsèqu
1134779684116471808,applaudi arrivée stad martyr rwanda
1134779676562530304,obsequestshisekedi denis sassou venir de arriver stade martyr
1134779621034143744,art capoeirer helping former child soldier feel like kid
1134779615870955520,last night u border patrol agent apprehended illegal alien angola cameroon near u
1134779596283502592,aller rappeler force mobutiste guerre pool allez arrêter parler
1134779591531401217,obsèquesetshisekzdi arriver inster président centrafricain e faustin  archange touadéra
1134779570530476032,oramah délégation afreximbank visite recevoir président felix tshisekedi
1134779569112866816,wrap mpc chair ceo close mackinac policy conferenc
1134779554361413638,samedi er juin chef etat e féli  antoin tshisekedi tshilombo arrivé stad martyr
1134779547776368640,utiliser dépouille sphinx monnayer de échang gâteau opportunité réconciliation rwanda
1134779506093363200,samedi er juin chef etat e féli  antoin tshisekedi tshilombo arrivé stad martyr
1134779502066839552,las teoría ocultan tra segunder mayor epidemia ébola del historia
1134779439697604613,sulla flat tax concordo come pur sul sono misure liberist sulla narrazion
1134779393744744448,combat démocratique récompenser tshisekedi « grand coordon » ordre héros national kabila  lum
1134779383145783299,retour visite kagame kinshasa image
1134779375633797127,dhs insider eed us migrant made user confirmed case ebola custody
1134779343845101568,président zambien edgard lungu également présent stade martyr
1134779343794819072,llegamo olivenza ante visiter toca disfrutar gastronomía olivenza con savoir postre típico fécula mécul
1134779340447784961,félix tshisekedi malédiction rd inviter paul kagame bourreau chef obsèqu
1134779327944564736,olivenza encontramos uno los museo má original dedicados al papercraft eeriencias_alquever rdc_la http
1134779313792925697,rd congole chinois racheter société tenke fungurume mining hautkatanga désengager eatrier
1134779312492687360,
1134779312203284490,arrivée inster président zambien e edgar lungu stade martyr
1134779304749830144,last night u border patrol agent apprehended illegal alien angola cameroon near u
1134779296168513536,celui père « sphinx limeter » président républiqu engager auprès famille rap
1134779292263559169,wish fellow kenyan great madaraka day democratic republic represer president
1134779284520931328,una las visiter obligada olivenza savoir museo etnográfico con sala dedicader los oficio podemo culminar
1134779279353495552,wish fellow kenyan great madaraka day democratic republic represer president
1134779260563070976,dire kabila refuser katumbi vienn mem venir voiture chauffeur peur
1134779223200141312,una las eeriencia hemo podido disfrutar alqueva ser pilotos por día eeriencias_alqueva rdc_la
1134779200257318913,u border patrol agent assigned del rio sector apprehended large group individual angola cameroon
1134779169374658561,president kagame arrived kinshaser democratic republic begin visit tête têt
1134779141910401025,obsèquesetshisekzdi arriver inster président centrafricain e faustin  archange touadéra
1134779115414982657,incident cortéger président républiqu gouverneur ville kinshasa
1134779115373043717,chef ne être jamais retard ce être moment prévoir
1134779104539086848,rendre hommage etienne tshisekedi wa mulumba acteur politique majeur grand combattant lutter p
1134779067381760001,i' m bryanston dud
1134779063074205696,vraiment
1134779046062112770,tshisekedi principal opposant absent hommage officiel étienne tshisekedi
1134779027326152706,arrivée inster président zambien e edgar lungu stade martyr
1134779022913736705,cérémonie hommage étienn tshisekedi se être tenir vendredi mai stad martyr kinshaser mé
1134778977510445057,arrivée inster président zambien e edgar lungu stade martyr
1134778964541468673,last night u border patrol agent apprehended illegal alien angola cameroon near u
1134778941451964416,arrivée inster président zambien e edgar lungu stade martyr etherosnational
1134778925534580736,per fare e quota non è colper dell' ue è colpa nostra
1134778923223437312,one day human right observed silence lamb disturbed truth
1134778903191531520,mentr io conosco chi ha votato x aver e sai chi sono fannulloni cronici del mio
1134778884568883200,rtnc annoncer déjà présent stad martyr
1134778876612218881,dhs insider eed us migrant made user confirmed case ebola custody
1134778859595927552,wish fellow kenyan great madaraka day democratic republic represer president
1134778827413118976,partir moment inviter applaudissez kagame falloir laisser jkk participer
1134778812040978432,last night u border patrol agent apprehended illegal alien angola cameroon near u
1134778798937923584,dire kabila refuser katumbi vienn mem venir voiture chauffeur peur
1134778770261512192,miksi kongon kriisi unohdettu mitä seurauksia tällä ollut kongolaisill toiminnanjohtajamme harri hak
1134778753488433153,présidence photographe conger
1134778740393893888,dernier jour obsèque étienne tshisekedi stad martyr parmis gouverneur note présence gouv
1134778646273675265,monde absent le investiture fatshi
1134778628598841344,nyirarukundo' s face say armed men attacked family democratic republic nyirarukundo ran one way heure
1134778628145897472,last night u border patrol agent apprehended illegal alien angola cameroon near u
1134778616267640832,président comité politique participer vendredi mess mémoir eremier ministre
1134778616007548929,arrivée inster président zambien e edgar lungu stade martyr
1134778589474426880,samedi er juin chef etat e féli  antoin tshisekedi tshilombo arrivé stad martyr
1134778584093069312,u border patrol agent assigned del rio sector apprehended large group individual angola cameroon
1134778578669883392,africans graduated negro status alien according disrespectful human kin
1134778576010698753,
1134778570730070018,mbote premier production made cour téléchargement impatient
1134778560290406400,
1134778544901566464,bana déjà regarder film « habit neuf gouverneur » film spécial
1134778536076697600,people w confidence government rwander botswana ethiopia mozambi
1134778515579113473,pétrole principal fournisseur trouver afrique te as rai
1134778490350460928,u border patrol agent assigned del rio sector apprehended large group individual angola cameroon
1134778479294210048,dhs insider eed us migrant made user confirmed case ebola custody
1134778476614115329,dhs insider eed us migrant made user confirmed case ebola custody
1134778475749863424,détest eression « chance » malchance cell
1134778472268730368,think need hug
1134778470695931904,ah oui jeune ne avoir vivre direct rien que à travers documentaire
1134778465746599937,opposant absent hommage officiel étienne tshisekedi
1134778432531963905,samedi er juin chef etat e féli  antoin tshisekedi tshilombo arrivé stad martyr
1134778428983578624,rdcongo utilis infox tribalo  ethnique pousser communauter battre politicien véreux
1134778424277504001,précision prochain article
1134778396314144768,tripartitensele photodefamill issu réunion tripartite président rwandais angoler
1134778381487226884,kijk naar leopold kijk naar frankrijk moslim marokko alg
1134778377641123840,forcé corps vie le exil pavaner le aéroport accueillir dépouill mortel
1134778369487376384,rai kusema president ngungu kabiler aiko tena president
1134778364806352896,
1134778346645139457,dangerous country women afghanistan syria somalia saudi arabier
1134778345902792704,ebola seuil cas presque franchir
1134778290219229184,last night u border patrol agent apprehended illegal alien angola cameroon near u
1134778260150263808,last night u border patrol agent apprehended illegal alien angola cameroon near u
1134778257944002560,total case confirmed case confirmed deaths drcongo' s largest  ever known ebola outbreak read
1134778228311318528,rdcongo meilleur manière de honorer mémoire feu dr étienn tshisekedi wa mulumba ce être pérenniser idéal
1134778225043955712,white bol international airport way democratic republic representing heure e presiden
1134778224972636160,voeu changer nationalité venir investir natal
1134778212108685314,sufre epidemia má letal savoir historia ya hay má muertos por ébola desd el último brote desconfia
1134778159822450688,last night u border patrol agent apprehended illegal alien angola cameroon near u
1134778139886985216,last night u border patrol agent apprehended illegal alien angola cameroon near u
1134778137194172416,rendre hommage etienne tshisekedi wa mulumba acteur politique majeur grand combattant lutter p
1134778127559856128,arrivée inster président zambien e edgar lungu stade martyr
1134778106710020096,last night u border patrol agent apprehended illegal alien angola cameroon near u
1134778098401124352,last month saw divers range alert raised start network member amidst multiple high  profil crise start
1134778077924515840,stad fnb jo' bourgh ne être remplir obsèque nelson mandela présence populaire ba
1134778076972404737,peuple rdcongo rendre vibrant hommage étienn tshisekedi le un principal leader politique depui
1134778052779659266,ebola seuil cas presque franchir
1134778047754919936,furbetti del reddito di cittadinanza sicilia già beccati cont dimaio furbetti
