,cleanned_tweet
1134767232934961152,ver olivenza desd el aire una eeriencia alucinant ven perfectament las antiguer muralla forma estrella
1134767227406888961,garde corps de etienne tshisekedi man
1134767213104246784,place like would skin hang like wild game speech country
1134767161157791744,nell migliori piazze italian e prossimament
1134767150600785920,penser que on definir vulgariser concept opposition pcq apparemment bcp penser jamais
1134767149342347264,encroir rfi matin joseph kabila refuser présence katumbi obsèque tshisekedi le avoir obtenir
1134767138403749888,dhs insider eed us migrant made user confirmed case ebola custody
1134767133429309440,cérémonie hommage feu etienne tshisekedi photo lire
1134767122935156736,obsèquesetshisekedi président féli  antoine tshisekedi denis sassou ne guesso participer
1134767110146711555,etienne tshisekedi admettre titre posthume ordre national héros national kabila  lumumba grade gr
1134767082699132928,rwanda laisser jamais paix ce être ennemi dangereux
1134767078240595968,penser que on definir vulgariser concept opposition pcq apparemment bcp penser
1134767078035120128,dernier jour obsèque étienne tshisekedi stad martyr parmis gouverneur note présenc
1134767062642044928,vraiment pré an de independance devoir continuer croir que il incapa
1134767056589611008,utiliser dépouille sphinx monnayer de échang gâteau opportunité réconciliation rwanda
1134767052638564352,osm opendater logicielslibre afrique actionosmbrazzavill petit vingtaine cartographier osm aprè
1134767041804689408,démocratie hein pleure pèr peur congonouveau
1134767022687051776,rediff lir congocrisi lesaviezvous devoirdemémoir corruption kinshasa new  transkin
1134767017695875073,étienn tshisekedi admettre titre grand cordon le ordre national héros national kabila  lumumba
1134766999886794758,cherche justifier mal mal le autre parlon d.rc non lamuker
1134766985068175360,
1134766960758153217,volando voy volando vengo alucinant extremadura desd el cielo eeriencias_alqueva rdc_la
1134766915090571264,etienne tshisekedi buried dr
1134766913660305409,muander nsemi également présent obsèque de etienne tshisekedi stad martyr
1134766883746582528,etienne tshisekedi buried dr
1134766877723545601,rendezvous prendre demain dimanche mai
1134766820542599169,
1134766812443422721,first mettre etienne tshisekedi u charger de affaire kinshasa consider fathe
1134766805329817600,istandwithmarthakay afterall package look untouched still wrapped original packaging seal wh
1134766796236627968,etienne tshisekedi buried dr
1134766761394487297,reality artist lif kinshaser
1134766757963599872,parler grand chancel parce  que rire oublier reste activ
1134766756709490688,patriach dr etienne_tshisekedi mérite faible mobilisation stad martyr metton côter cli
1134766754503307269,transport funéraire international cerceuil principal réglementation impose envelopper cerceuil envelo
1134766752498376710,wish fellow kenyan great madaraka day democratic republic represer president
1134766744361480192,rediff lir congocrisi lesaviezvous devoirdemémoir corruption kinshaser bus société
1134766739235848192,etienne tshisekedi buried dr
1134766684873613313,aim tweet lire réaction follower insulte
1134766673184067584,peine an a.kimbuta déjà créer sociéter transport succéder bilan gestion transco retranskin
1134766670613032961,palmarès
1134766601998413824,report accuser rwanda paulkagame training rebel oust burundian leader story still true today wor
1134766570608177154,last night u border patrol agent apprehended illegal alien angola cameroon near u
1134766559879139328,secoursdeshomme asso humanitaire guipava finistere soutenon thailande madagascar cameroun
1134766544028930048,gabriel kyungu wa kumwanzer également présent obsèque de étienn tshisekedi
1134766534562406400,camp kabila udp peur moisekatumbi exclure liste invité
1134766533723480064,etienne tshisekedi admettre titre posthume ordre national héros national kabila  lumumba grade gr
1134766466572546048,
1134766402492076032,one poorest countrier one poorest region refugee welcome peopl
1134766366291058688,last night u border patrol agent apprehended illegal alien angola cameroon near u
1134766355369091072,rendre hommage etienne tshisekedi wa mulumba acteur politique majeur grand combattant lutter p
1134766314931871746,dire « peuple abord »
1134766305234608128,drcongo president tshisekedi repatriate remain father died punch vi
1134766275392094210,u border patrol agent assigned del rio sector apprehended large group individual angola cameroon
1134766239572746240,first mettre etienne tshisekedi u charger de affaire kinshasa consider fathe
1134766177463541760,dimanche matin rfi le émission changement politique
1134766155304820736,dhs insider eed us migrant made user confirmed case ebola custody
1134766138112585728,di maio le italia aller mal percher governater da incompetenti dai gestion comuni fai dei corsi di form
1134766112367960065,last night u border patrol agent apprehended illegal alien angola cameroon near u
1134766108060377088,ituri may commemoration international peacekeeper day observed ndromo cob
1134766101651513344,rdc  ituri centaine vache piller milicien frpi près boga afrique info magazin
1134766092382064640,ebola may children age fiv accounted 300/1949 evd case reported children
1134766086300340224,courage honorable coeur
1134766077286785024,oublion facilement pays kagame ang que il
1134766073214119936,dhs insider eed us migrant made user confirmed case ebola custody
1134766027210989569,ce être le école joue aimé jeune reporter le être rd le équation simple élè
1134766026292379648,u border patrol agent assigned del rio sector apprehended large group individual angola cameroon
1134765993337769984,first mettre etienne tshisekedi u charger de affaire kinshasa consider fathe
1134765928808439809,obsèque de étienn tshisekedi lieu aujourd'hui kinshaser journer recueillement populaire
1134765896269029376,le histoire enseigne considérer héro toujours proclamer traitre prof
1134765882083860480,angola rwanda réunion tshisekedi kagame lourenço marge cérémonie hommage vouloir renforce
1134765831982931968,kagame ovationner stad scène simplement impensable gomer bukavu gen vivre paix fon
1134765826396098561,last night u border patrol agent apprehended illegal alien angola cameroon near u
1134765799804006400,etienne tshisekedi buried dr
1134765785962950661,etienne tshisekedi admettre ordre national héros national kabila  lumumba grade grand cordon officiel ht
1134765756338626560,présent obsèque de étienn tshi
1134765755558498304,breaking ebola concern texa illegals cross border us v
1134765733584482305,bruxelle di maio tria neller letterer tagli savoir reddito di cittadinanza quota e welfare trier e che
1134765709601464321,prof oramah led afreximbank delegation stater visit received president felix tshisekedi
1134765690102198273,special part africer
1134765689548525568,obsèque de étienn tshisekedi lieu aujourd'hui kinshaser journer recueillement populaire
1134765649341739008,ye ye mex wer .. angola cameroon call olympic level long distance swimming
1134765635236446209,obsèque de étienn tshisekedi lieu aujourd'hui kinshaser journer recueillement popu
1134765629179944960,first mettre etienne tshisekedi u charger de affaire kinshasa consider fathe
1134765607176560640,lincoln navigator con questa cittadino che usufruisce del sarà accompagnato colloqui di lavo
1134765585521418241,take money buy way ticket get passport let sun set
1134765564159766528,abbraccio insolito è quello che andré bauma capo custod del centro senkwekwe per gorilla orfani nel parco nazional
1134765509407363072,rdc  rwanda responsable crime commettre citer mappingreports devoir recevoir tapi
1134765498892214273,last night u border patrol agent apprehended illegal alien angola cameroon near u
1134765479120252929,acteur politique hypocrite lire commentaire un feu tshisekedi
1134765445272281088,last night u border patrol agent apprehended illegal alien angola cameroon near u
1134765434811670528,last night u border patrol agent apprehended illegal alien angola cameroon near u
1134765430831288321,le histoire enseigne considérer héro toujours proclamer traitre prof
1134765412405645312,dhs insider eed us migrant made user confirmed case ebola custody
1134765405438926848,je avoir le honneur rencontrer acteur le écosystème tech lubumbashi découvrir beaucoup solution innova
1134765394609283072,paul kroi gammer tueur froid exterminateur imperturbable opposant celuilà
1134765385604116481,abbraccio insolito è quello che andré bauma capo custod del centro senkwekwe per gorilla orfani nel parco nazional
1134765366788415488,wish fellow kenyan great madaraka day democratic republic represer president
1134765330818129920,« chef etat convenir renforcer axe angola rwander trouver voie moyen
1134765322496610304,etienne tshisekedi buried dr
1134765321963888640,obsèque tshisekedi fayulu venir bemba muzito katumbi également grand absent
1134765315911536640,étienn tshisekedi admettre titre grand cordon le ordre national héros national kabila  lumumba
1134765299725586433,imagine fleeing night imagin knowing next meal would imagin born war zone imagin
1134765277445533696,etienne tshisekedi buried dr
1134765266397814784,savoir ville vouloir malheureusement spécial
1134765240216952832,tripartitensele photodefamill issu réunion tripartite président rwandais angoler
1134765219828371456,jeune an jamais connaître paix tel réunion leader
1134765164954128384,danish refugee council recent availabl employment opportunity danish refugee council recent availabl
1134765032229756928,money tweet
1134765010436202496,pendant centrafricain faustin archange touadera arriver ds capital congolais accueillir descent
1134765008221609984,baoloba kaker mpiaka ya stade le aéroport ti na
1134764999493193728,oui merci gest combien patriotique ce être gagn
1134764997081489408,logique condamneriez  vs maître penser
1134764981940084736,bonjour prof vien suivre direct rtnc beau témoignage sé chola kabamba andré eg intérimaire krtv
1134764961455063040,chow chow picked straw ran san francisco stopped ryan gosling ask direction
1134764949631381504,nature horreur vide bcp comprendre le importance stratégique peupler pays
1134764943998369792,dhs insider eed us migrant made user confirmed case ebola custody
1134764919595962369,dimanche matin rfi le émission changement politique
1134764915602989056,group peacekeepers uruguay searched high low congolese jungle eerts vanished
1134764907268923392,étienn tshisekedi admettre titre grand cordon le ordre national héros national kabila  lumumba
1134764903527530497,
1134764902399299585,overhaul ebola vaccination strategy case surge
1134764893134106624,overhaul ebola vaccination strategy case surge
1134764875723530240,check relix' s new post year jazz fest mickey hart ghost square
1134764844090122240,etienne tshisekedi admettre ordre national héros national kabila  lumumba grade grand cordon officiel ht
1134764841506418688,etienne tshisekedi buried dr bbc new
1134764824766926848,opposant exclure obsèque de etienne tshisekedi particulièrement le ancien
1134764801387913216,condamnon regretton
1134764799655653376,last night u border patrol agent apprehended illegal alien angola cameroon near u
1134764784837189632,ce être dommage aller
1134764754164228099,vien de arriver stad martyr kinshaser assister obsèque officiel le ancien premier min
1134764728289566721,group peacekeepers uruguay searched high low congolese jungle eerts vanis
1134764705837400064,overhaul ebola vaccination strategy case surge
1134764663902736385,overhaul ebola vaccination strategy case surge
1134764654742384641,
1134764642906058752,etienne tshisekedi élevé rang de héros national plutôt admit quelque instant titre posthume
1134764642494963719,kagame ovationner stad scène simplement impensable gomer bukavu gen vivre paix fon
1134764595552194561,
1134764591408394241,etienne tshisekedi élevé statut héro national inhumation jeudi
1134764581732147200,border country million km² estimated population million democratic republic occup
1134764545992482816,last night u border patrol agent apprehended illegal alien angola cameroon near u
1134764523515207681,pleure voi kagame ovationner taliban le urs fayulu rejeter ah yatshitshi comba
1134764501591560192,e tshisekedi sacré héro national lumumba kabila
1134764467500310528,check relix' s new post year jazz fest mickey hart ghost square
1134764441298513920,président etienne tshisekedi effectuer ultime voyage trouver enfin repo éternel p
1134764436189847553,vision mk frère katumbi dire pactise diable
1134764374239916032,dhs insider eed us migrant made user confirmed case ebola custody
1134764337002946560,mucher gracia
1134764330250121217,etienne tshisekedi buried dr bbc new
1134764320015998976,sufre epidemia má letal savoir historia ya hay má muertos por ébola desd el último brote desconfia
1134764312675934208,soja produire monde destiner nourrir animal élevage
1134764290190086144,etienne tshisekedi admettre titre posthume le ordre national héros national kabila  l
1134764231574925312,
1134764229683290113,étienn tshisekedi admettre titre grand cordon le ordre national héros national kabila  lumumba
1134764212750815232,etienne tshisekedi admettre titre posthume ordre national héros national kabila  lumumba grade gr
1134764178520956928,dhs insider eed us migrant made user confirmed case ebola custody
1134764156647878657,volando voy volando vengo alucinant extremadura desd el cielo eeriencias_alqueva rdc_la
1134764146648633344,arrivé hier nuire ce être assister obsèque président étienne tshisekedi
1134764119104643072,résultat jour dézinguer comore score favori respecter
1134764079258767360,muander nsemi également présent obsèque de etienne tshisekedi stad martyr
1134764036820803585,
1134764008064655360,garde corps de etienne tshisekedi man
1134763968130666497,bilis  man balón hojalata
1134763951902855168,mike mukebayi poursuivi diffamation immunité lever attendre procédure ju
1134763950879457280,ebolahackathon nouveau stratégie communication lutter ebola jeuneinnovant
1134763941597515776,président sassou arrivé stad martyr
1134763929479962624,kagame venir rendre hommage le opposant historique kidnapper abattre opposant
1134763927076782080,last night u border patrol agent apprehended illegal alien angola cameroon near u
1134763916125528064,ben quoi mariage oncle araigner je avoir pouvoir aller peux
1134763915752214528,el ébola ha dejado ya muertos una epidemia una magnitud todavía desconocida hablamo con el
1134763893522198528,proud alexa rest team represent today
1134763888065556481,également présent stad martyr trois jour kinshaser
1134763879974735873,condamnon dernier énergie le insécurité tanganika
1134763874861932544,celebramos el del día áfrica nuestro auditorio con presencia representante angola argelia túnez
1134763871095349249,opposant exclure hommage officiel étienne tshisekedi
1134763870537617408,¡ nuevo reto directore deportivos por día youtube chiringuitoinsid ¡ lo
1134763856339886080,read nothing else today read heart breaking piec heavy toll congo' s ebola epidemic inflicting
1134763847326281729,kagame ovationner stad scène simplement impensable gomer bukavu gen vivre paix fon
1134763821048971264,terrifying headline day award goe think got problem try living part bothered
1134763802568863744,territoir beni offensif victorieux fardc jeudi mai heure matin combattant adf
1134763706917826561,
1134763683811340288,ce être ngbanda conseiller mobutu tuer pendre pentecôt conserver pouvoir
1134763643428659202,dhs insider eed us migrant made user confirmed case ebola custody
1134763631411912704,nordkivu trois mort rescapé accident minier quartier mero kamituga
1134763631332249600,le absence kinoise kinoi justifier faite avancer déjà mausoler nsele
1134763614055870465,ce être mettre niveau ld kabila certain pouvoir penser etienne
1134763604773937158,heureusement que il ne avoir erreur de élever pèr hérosnational tshisekedi mériter
1134763583697498113,etienne tshisekedi buried dr
1134763499886927872,ignorance eza mawer rapide juger
1134763454508740608,étienn tshisekedi sensiblement affaiblir mobutisme deller kawino
1134763427581321216,
1134763372858286081,¡ nuevo reto directore deportivos por día youtube chiringuitoinsid ¡
1134763368445829121,radio okapi etienne tshisekedi admettre titre posthume 039rdre national héros national kabila  l
1134763288502439937,rendre hommage etienne tshisekedi wa mulumba acteur politique majeur grand combattant lutter p
1134763285268451328,last night u border patrol agent apprehended illegal alien angola cameroon near u
1134763260023119872,north  kivu may brigadier general dinesh singh bisht commander central sector monusco
1134763237017341952,new rwanda  drc  angola axis born kinshaser
1134763236463697921,congo' s reaction kagame arrived tshisekedi funeral
1134763185217703939,shocking shocking find stopmessokdja
1134763183636393985,osm opendater logicielslibre afrique actionosmbrazzavill petit vingtaine cartographier osm
1134763157011013632,funeral veteran opposition leader etienne tshisekedi set take place today mr tshisekedi passed away
1134763139499794432,jaise wo ter ka reply karega
1134763124161220608,etienne tshisekedi élevé statut héro national inhumation jeudi
1134763124056346624,ebolahackathon nouveau stratégie communication lutter ebola jeuneinnovant
1134763105479737344,wish fellow kenyan great madaraka day democratic republic represer president
1134763100064944130,deep thought
1134763070423797760,notare che neanch lo citano più sto logo lo vogliamo cambiare mettiamo quello della lega e tanti saluti dai
1134763067189972992,united kingdom past year worked tirelessly secur place list country named
1134763057517932544,etienne tshisekedi élevé statut héro national inhumation jeudi
1134763019160961025,voi cause ne évoluer
1134762995207348225,reading one childne tre great story individual action climateactionnow asant saner children
1134762943952953344,soutien famille tshisekedi peuple éprouvé relève grandeur coeur je encourager
1134762933739827202,el ébola ha dejado ya muertos una epidemia una magnitud todavía desconocida hablamo con el
1134762881692590082,august mae colombo
1134762872888864768,pensa salvini savoir una cosa ha puntato ha fatta scu
1134762826206236672,ummm largest outbreak ebola occurring speak please declar emergency
1134762817020669952,soutien famille tshisekedi peuple éprouvé relève grandeur coeur je e
1134762792567881729,ds « tshisekedi retour » commentaire eliqu etienne tshiseki
1134762771160002560,
1134762722300760064,etienne tshisekedi admettre titre posthume le ordre national héros national kabila  lumumba
1134762715027841024,vl1 meilleur gardien saison championnat voter retweeter
1134762714063036416,huhu kiter na lang tayo pag andito na gino
1134762688024891393,kinshaser hasinyiwe amasezerano yo guhashya inyeshyamba zirimo niza nyamwasa ziri mu misozi ya minembwe
1134762629057142784,ouiii parlant amnésie rappellez  vs final kigali coupe africain foot chan gagn
1134762622924935169,bbc etienne tshisekedi buried dr 2019  06 0119z
1134762622731972608,dangerous country women afghanistan syria somalia saudi arabier
1134762619032743936,awoke morning fabulous view ubangi river largest right  bank tributary river u
1134762618453991424,« vendredi dernier trois décharger guérie » témoigner habi  tante manginer réponder
1134762579916722182,u border patrol agent assigned del rio sector apprehended large group individual angola cameroon
1134762569544216577,coopopopé moni
1134762549235343361,good morning please help people kabiler tshisekedi planning kill congole
1134762547918172160,
1134762516213575680,ce être riter islamique int
1134762466548834304,started reading scrambl africa thomer packenham somehow kind book confirm thing know without k
1134762433610952704,wish fellow kenyan great madaraka day democratic republic represer president
1134762405941133313,adresse tout compassion président félix tshisekedi ainsi ensembl famille défunt jour
1134762363767463936,belgique blanc connaître plat
1134762306909294592,
1134762300831928320,rdc  ituri centaine vache piller milicien frpi près boga afrique info magazin
1134762269030670336,mawer mbeya mbeya aujourd hui muzito devenir opposer
1134762227708440576,etienne tshisekedi admettre titre posthume 039rdre national quot héros national quot kabila  lumu
1134762194573385728,dépouille etienne tshisekedi figurer le opposition mort an belgiqu arriver hier soir
1134762137660928000,tunisie final créteil remontader spectaculaire rd bravo frérot yas
1134762106643816449,
1134762095608655874,
1134762090537934848,
1134762085773193216,hommage etienne tshisekedi etienne tshisekedi incontestablement acteur politique majeur pa
1134762074263961600,te as répondre rwanda ne avoir jamais terrasser base quoi désta
1134762070069719040,obsèquesetshisekedi président rwandais paul kagame angolais joão lourenço rendre hommage feu etienn
1134762063446904832,last night u border patrol agent apprehended illegal alien angola cameroon near u
1134762036125163520,obsèquesetshisekedi président rwandais paul kagame incliné dépouill feu etienne tshiseke
1134762020233011202,rendre hommage etienne tshisekedi wa mulumba acteur politique majeur grand combattant lutter p
1134762005078990848,tripartitensele photodefamill issu réunion tripartite président rwandais angoler
1134761998514884608,cinq pire bourreal démocratie afriqu paul kagame rwanda faur gnassingbe togo alpha conder guin
1134761989316775937,peril sembler tt politicien politicailleur permettre cam
1134761957725212673,félix tshisekedi malédiction rd inviter paul kagame bourreau chef obsèqu
1134761912619716610,bienaimé manquer peuple manquer soir heureux remercier dieu toutpuissant
1134761888083062784,etienne tshisekedi buried dr
1134761879094607872,nobody talking ebola pandemic outbreak first case mad
1134761832386744326,tshisekedi er docteur droit le université lovanium merci ya tshitshi de avoir exemple gén
1134761811142750209,impeu mpangistanais le avoir récemmen
1134761722970066945,etienne tshisekedi buried dr
1134761719610466305,report accuser rwanda paulkagame training rebel oust burundian leader story still true today wor
1134761716967923713,
1134761679416451073,obsèque tshisekedi e sphinx limété inhumer heure kinshasa sel comité organisat
1134761654678360064,etienne tshisekedi admettre ordre national héros national kabila  lumumba grade grand cordon offic
1134761620520022016,
1134761599594635266,shocking shocking find stopmessokdja
1134761585530957824,´
1134761560293949442,te e origin français ce être que on demande bretagn côter gramme
1134761531508428800,
1134761521567936512,obsèque siècle rd félix tshisekedi parer sacralité politique mystique pèr
1134761508536295425,résultat cinq dernier match liverpool tottenham pouvoir parier
1134761498444742658,merci president kabila ete le architecte democratie référen
1134761488613330944,reconner vrai ami malheur merci beaucoup excellence pk
1134761459932631040,stupid know kill million people
1134761451623723013,total case confirmed case confirmed deaths drcongo' s largest  ever known ebola outbreak read
1134761437270761472,avete fatto una battaglia contro e vi definite sinistrer e adesso mi parli di pover gente
1134761426256617472,tshisekedi principal opposant absent hommage officiel étienne tshisekedi
1134761415288512512,etienne tshisekedi buried dr
1134761393050308613,president kagame pays respect lat etienne tshisekedi former prime minister democratic republic con
1134761364537466880,revanche le africain terrible humanright
1134761351635709952,
1134761348926181377,breaking ebola concern texa illegals cross border u
1134761345033822208,
1134761321147326465,garde corps de etienne tshisekedi man
1134761319972900864,elicater le ordre national héros national kabila  lumumba kinshasa tshisekedi clic savoir
1134761284682096640,ds « tshisekedi retour » commentaire eliqu etienne tshiseki
1134761278298308613,mme mari muhombo venir nommer vicegouverneur province nordkivu mois avril dernier mme muhombo aver
1134761275546832896,félicitation ville beni aller devoir vivre paix
1134761271230894080,el ébola ha dejado ya muertos una epidemia una magnitud todavía desconocida hablamo con el
1134761269502795776,etienne tshisekedi buried dr
1134761211508207616,i' ve waiting analysi years i' m sure hold colonie indonesia braz
1134761207561424896,également présent stad martyr trois jour kinshaser
1134761188166909952,impression majorité intéresser football france espagne
1134761177068822528,think demons roky play field blessed mr erickson
1134761176066224129,
1134761163508604928,programme officiel prévoit bel élévation tshisekedi statut héro national
1134761150405591040,opposant exclure hommage officiel étienne tshisekedi
1134761136434364421,etienne tshisekedi buried dr
1134761132068151296,le avion transporter dépouille de etienne tshisekedi vient de arriver kinshaser de info
1134761102368235520,colonisation économique chinois territoire kambove katanga
1134761095003086848,encroir rfi matin joseph kabila refuser présence katumbi obsèque tshisekedi le avoir obtenir
1134761092771659776,comprendre le esprit loi ne y héro national kabiler lumumba
1134761084894830592,rdcongo meilleur manière de honorer mémoire feu dr étienn tshisekedi wa mulumba ce être pérenniser idéal acte
1134761079102464001,
1134761072752308224,president kagame arrived kinshaser democratic republic begin visit tête têt
1134761056847499265,imagine fleeing night imagin knowing next meal would imagin born war zone imagin
1134761051617185792,
1134760994088128514,photodujour goma monusco général corps armée elia rodrigue martin filho commandant
